label	tweet
neutral	sesiapa yang membuat ibu dan bapaknya gembira (memberi keridhoan) maka sesungguhnya ia mendapat ridho allah s.w.t. (hadis riwayat bukhari) perjuangan penerapan syariah ..
neutral	tidak ada semangat
neutral	yg kaca lebih enak menurutku tapi boleh tu dicoba versi kemasan kotaknya~
neutral	masih mendung cerah
neutral	enak bgt jd mba nain
neutral	enak aja
neutral	pake popsocket enak ga si? aku belom pernah coba soalnya wkwk
neutral	tangannya di gips aja masih semangat main.
neutral	bmkg memprakirakan bahwa hujan ringan berpotensi terjadi di sejumlah kota besar di indonesia.
neutral	menteri bumn 2 mengajak para warga memanfaatkan lahan perumahan menjadi lokasi2 pertanian. erick thohir pun menggagas program bernama2 energi tani2 atau et. dia menjelaskan, gerakan energi tani bertujuan membumikan semangat bertani.
neutral	hoam semangat kerja
neutral	ayam penyet sambel ijo kak. enak sih. tp nguantri banget
neutral	lebih enak sahabat dulu baru jadian terus nikah
neutral	asal bapak senang
neutral	dia memberi kekuatan pada yang lemah dan menambah semangat kepada yang tiada berdaya
neutral	parah iyo, enak rebahan cuy mbi ndelok udan
neutral	bukan uang banyak yg perlu kita punya. tapi ngobrolin rencana2 indah aja udah bisa bikin kita bahagia. - mama
neutral	cucianku numpuk gara2 hujan semalam untung cuacanya cerah hari ini
neutral	karena blm dapet gantinya, karena blm tentu kerjaan yg baru lebih enak drpd yg lama
neutral	malah minyak satu harga adanya cuma di awang awang.. kudu produksi sendiri minyaknya..
neutral	enak gasih digituin?
neutral	gawajib nder. apalagi maaih bisa jangkau materi dari guru semangat sekolahnya
neutral	,, jadi lapang terang enak ya buat jalan..
neutral	namanya juga hidup enak ga enak ya tetep harus kita nikmati
neutral	nanti tunggu free aja biar enak sleepkol dan vc nua
neutral	oyi sek isuk wes udan ngene enak e lapo
neutral	teh susu yang bikin enak apanya?
neutral	ketika kamu gembira, kegembiraanmu tidak melampaui hakmu.ketika kamu berkuasa, kamu tidak mengambil sesuatu yang bukan hakmu. itulah adab orang beriman
neutral	dengan bersyukur kita akan senantiasa diliputi rasa damai,tentram dan bahagia
neutral	enak nya makan yang anget2 ni
neutral	jadikanlah dirimu alasan orang lain tersenyum bahagia. :)
neutral	belum sarapan sih.. ini lagi ujan indomie soto plus telur enak kali ya
neutral	ceria dan bersinar selalu itu aku melody | oshimen melodyjkt48 & officialjkt48 | share info , quiz , games | |
neutral	aplikasi premium,2» henlo benlo ! aku jual app premium nih. ngga enak 'kan kalau acara asikmu diganggu iklan, yuk beli app prem di aku ! trusted legal bergaransi proses cepet minat? dm or tele ?anathaa
neutral	jika anda ingin bahagia, menikahlah dengan pria yang berwibawa. wii .. bawa mobil. wii... bawa duit.
neutral	jangan mengeluhkan masalah yang datang dalam hidupmu. terkadang kamu harus merasakan sakit untuk dapat mensyukuri bahagia.
neutral	diet paling enak, disukai semua orang,turun bb cepat orderwa 085799289494 bbm:d19cb7a3
neutral	jangan pikirkan kegagalan kemarin, hari ini sudah lain, sukses pasti diraih selama semangat masih menyengat.
neutral	setuju. apalagi kalau ada edukasi seks serta aborsi yang baik, orang-orang jadi paham bagaimana harus memperlakukan seks dan akibat2nya. selama ini orang-orang hanya fokus ke makin bayak seks bebas, makin enak, dst. it's not even the point
neutral	mari kak wa aja viu start 6k aja uda puas make sebulan. bisa req harga r utk c juga ¢¢ untuk sementara payment via shopee pay ditutup ya. shopee pay aku error. ¢¢ aku ready preset lightroom (via gdrive) ¢¢ no rush order
neutral	ular ,buaya , tikus jg klw udah dipanggang pasti enak
neutral	untuk meraih sukses, kita perlu motivasi kuat! namun untuk bahagia, kita bisa menikmatinya justru saat istirahat & bersyukur. (anonim)
neutral	terkadang diam itu lebih enak
neutral	bener wkwk, jual beli itu suka suka whales, dikira whales satu doang ada banyak, dan grupnya juga pisah pisah, mau jual beli juga suka suka dia, malah kalau dia jual ga bilang, tiba2 sorr aja, bilangnya cuman pas serok, patokan paling enak ya tradfi sama makro ekonomi
neutral	turun bb 8kg (testi wmp) solusi diet enak tanpa repot hanya rutin minum wmp juice aj order bbm wa 089654598758
neutral	usul oppa diterima ! senyuman pun diberikan pada pemuda; sebanyak apapun kue yang dia makan, bukan masalah. sebab ia suka makanan manis itu . oppa tau tempat beli kue paling enak tidak ? kalau tidak tahu, eun ae tau sekali.,
neutral	jangan merasa puas dengan pengetahuan yang anda miliki karna samudra ilmu membentang begitu sangat luas dan dalam.
neutral	masih semangat retwit nggak?
neutral	bakar lumbung mereka curi beras mereka biarkan mereka lapar.. kemudian datanglah pada mereka dan bagikan sepotong roti katakan pada mereka kamu sangat mencintai dan ingin mereka bahagia yakinlah dgn begitu kamu akan dicintai mereka kemudian minta mereka memilih mu jadi raja
neutral	namun, waktu kamu kembali untuk mengikuti gp99 ada perasaan senang, sedih, khawatir. karena jauh dari rumah, karena adanya rasisme, karena situasi cn kr. namun disana kamu bisa kembali membuktikan kemampuanmu.
neutral	bibi masak sayur bening katuk dong sama bakwan jagung,pake sambel terasi sama ayam goreng enak nih bi mau itu menunya iya tapi gk ada sayur katuk. aku anterin yuk ke pasar," yaudh ayuk " . mb bgt liat org makan begitu kmrn di rs
neutral	kasi garam biar enak
neutral	apa itu semangat?
neutral	legowo itu adalah semangat.
neutral	bubur gak enak
neutral	kita sering mengira diri ini lemah, kadang suka nggak puas atas pencapaian saat ini, tapi coba analisis lagi. kita juga udah melakukan hal dengan cukup baik, tidak menyerah aja itu udah point' plus, jadi mungkin bakalan baik lagi klo meyakini kemampuan diri sendiri.
neutral	orang yang mata batinnya baik akan bisa menerima kenyataan sebagai fakta & ia akan bahagia
neutral	q lak pas dolan nang pondk mojo, area pethok-keniten-bendo mojo ada lho, malah seng enak iku keniten.. pernah soale q mas
neutral	gak ileran ituu enak aja
neutral	lanjut gais. bbc skincare ini produk local ya, yang paling aku cinta n demen itu karna tekstur creamnya lembut ga lengket di aplikasiin ke muka enteng kaya ga pake apa2, ga ngedempul, kulit muka jadi cerah n glowing natural
neutral	erick thohir menjelaskan, tujuan gerakan et ini dibentuk guna membumikan semangat bertani masyarakat. ia pun ingin agar masyarakat dapat memanfaatkan lahan perumahan menjadi lokasi pertanian.,
neutral	kompor induksi ga cocok untuk masakan asia terutama masakan indonesia contohnya mau bikin nasi goreng ga bakal enak pake kompor induksi. nasi goreng butuh panas yang membara, sedangkan kompor induksi persebaran panas nya aja lama bgt.
neutral	sarapan pake nasgor enak gk yh
neutral	bahagia itu sederhana, cukup dengan selalu bersyukur ke pada allah swt..
neutral	kalo emak ku koleksi kopi top yg gratis gelas kata mas kopi nya enak, yaudah ibuk beli, sekalian dapet gelas nya
neutral	belum sarapan nunggu menang biar ada semangat lagi bang
neutral	justru dibikin biar inget kalo sakit tuh ga enak kan, musti jaga kesehatan jadinya
neutral	enak asal jgn diaduk
neutral	rehat sejenak dulu kok, kalo dah full gaskeun lagi biar enak
neutral	ada satu lagii harganya lebih mahal tapi emang bahannya enak banget. tar ya ku cek2 lagi
neutral	morning, semangat tipes nya.
neutral	cerah
neutral	ini kalo aku ya. paling ga bisa pake skincare kalo blm mandi. jadi aku selalu skincare setiap abis mandi. kalo malem gmn? ya mau tidur aku baru mandi. di rumah gerah soalnya, jd enak kalo mandi sebelum tidur.
neutral	tumben banget pagi pagi udah semangat, biasanya lelah letih lesu
neutral	kayaknya bakalan enak banget
neutral	betull itu enak
neutral	tapi kalau pengin paham lebih enak baca recap di youtube?google daripada pas lagi dalam in game, coba search dan baca2
neutral	isu pasal pendidikan yang paling aku tak puas hati dari dulu is kenapa sjk boleh dapat fasiliti lengkap compare dgn smk?k.
neutral	kok bisa kamu semangat
neutral	belum coba keduanya sih. btw, ada gaksih yang pake serum vit c bukannya tambah cerah malah hiperpigmentasi alias tambah gelap mukanya?
neutral	yg enak yak..
neutral	menteri bumn erick thohir mengajak para warga manfaatkan lahan perumahan mjd lokasi pertanian. erick thohir pun mnggagas program energi tani (et). energi tani brtujuan mmbumikn semangat bertani shingga masyrkt mnghasilkn produk" pertanian scra mandiri.
neutral	ketoprak lebih enak ya bang
neutral	kata temenku enak, tpi aiu belum pernah nyoba
neutral	semangat kerja tinggi memang tak menjamin kita sukses. tapi tanpa semangat sudah pasti kita tak akan sukses.
neutral	kebahagiaan akan datang ketika anda mampu membuat orang lain bahagia.
neutral	akhirnya setelah beberapa pertimbangan gw ga deactivate, tp gw logout dari apps untuk akun alter gw ini. ya karena gw masih belum bisa lepas aja sih. tahun kemarin gw rasa gw udah cukup puas bermain disini. berarti dm gw masih terbuka, walaupun ga tau kapan bakal bales dmnya
neutral	sahabat adalah mereka yang mampu mengeluarkan kemampuan terbaik yg ada dalam diri kamu. mereka yg selalu berimu semangat.
neutral	awali harimu dengan mendoakan seluruh keluargamu dan hidupmu agar bisa melalui hari ini dengan bahagia.
neutral	keknya pancake enak ya
neutral	setiap orang punya rumah , tapi tidak setiap rumah memiliki warna yang cerah sesuai keinginannya
neutral	tak peduli dengan apapun yang terjadi hari ini. miliki senyum yang membuatmu terlihat bahagia, dan doa yang membuatmu lebih kuat!
neutral	enak aja pingsan. aku kan anak sehat tubuh kuat
neutral	,, terima kementerian bumn pak mentri bumn erick thohir yo dukung gerakan energi tani (et) untuk produk tani mandiri semangat terus pak,
neutral	kegagalan pasti ada tetap semangat jangan putus asa elangga
neutral	dr playlist semangat pagi
neutral	lah anj enak banget??
neutral	gua dah nyusun jadwal+dosen enak jdi pas di buka tinggal pilih kelas yg dah gua catet
neutral	dulu pake pinguin, beli merek yg ad tasnya aja gitu. bei yg ponco aja lebih enak dinpake
neutral	2022 aku tau berat banget kedepannya. jujur jalanku buntu aku cuma mau ikut alurnya aja. tapi aku percaya sedih itu kaya bahagia, semuanya sementara. habis sedih pasti nanti bahagia kok, begitupun sebaliknya. semuanya bersifat sementara gapapa kok ya kan hatinya seluas samudra
neutral	nasi cikur teh nasi goreng pk cikur kitu teh..?? enak? *pakenanyaa
neutral	,, dengan et (energi tani) semoga petani bisa membumikan semangat bertani,erick thohir
neutral	springhill f tier breakfast, yang enak cuma sosisnya
neutral	selalu guru inget krn kelasnya beda aja vibesnya, penyerap energi guru guru krn kayak guru sblm masuk kelas mipa 3 awalnya santai santai aja ada yg semangat pas keluar kelas gue serasa logging out keserap energinya ama kelas gue
neutral	semangat nge ga
neutral	semangat 45
neutral	jangan pernah lelah dan putus semangat, karna ini derby della madoninna,milano siamo noi,momen derby della madoninna kapan yang tak terlupakan buat kalian?,
neutral	jangan takut karena menang itu membuat mu bahagia
neutral	jika kamu melihat matahari saja tidak sanggup apalagi melihat sang pecipta
neutral	para kecoak dan tikus curut setiap pagi sarapan dengan melakukan onani imajinasi lewat tagar yg mrka but sendiri. iya, karena cuma dengan cara itu mrk bisa merasakan senang dan menang
neutral	emang kalo cewek dan cowok sahabatan tanpa melibatkan 'perasaan' itu terkesan tidak mungkin ya?? padahal sahabatan dengan lawan jenis itu enak banget kalo lagi saling curhat, apalagi tentang pasangan masing-masing. yaa, walaupun sering dicemburuin sama pacar sahabat kita
neutral	hi teman smartfren, biar makin semangat lihat kucing lucu, gemesin banget ya kak. terima kasih-alin
neutral	tak perlu kesempurnaan untuk bisa berbahagia, jika kesederhanaan mampu membuatmu menjadi bahagia
neutral	kalo abis sakit lalu sebats udah berasa enak lagi, itu tanda kalo sudah sembuh
neutral	lockey sejati semangat
neutral	apa aku beres 2 rumah dulu ya?? biar enak
neutral	pemilu itu cuma masalah selera ibaratnya ada yang senang pake wc duduk yang lain senang wc jongkok,yang keluar sama aja tai
neutral	enak enak aja ah kak
neutral	info warung babi enak malang
neutral	udah semua nder dan aku suka semuanyatp ngga tau knp yg bebas laktosa lebih enak dri pda yg full cream
neutral	modal semangat tok
neutral	semoga cerah siang nanti, mau ambil buku sekalian ke mas pepen
neutral	eco farming punya cerita. salam tani makmur
neutral	nih 3 semangat banget anjirr
neutral	jaga kesehatan mental anda dengan lima tips sederhana inimental yang sehat, tidaklah melulu harus bahagia atau tak memiliki beban sama sekali. meskipun kita memiliki beban yang cenderung berat, akan
neutral	segerin dulu.. biar semangat
neutral	yuu semangat mekipun ga keluar air susunya
neutral	jinjin rocky gabisa minum gpp itu gabaik kok emang enak cola tapi jangan sering ya kk aku dah gak sering kalo dulu langganan
neutral	tetap semangat demi membayar kewajiban
neutral	dengan senang hati & terima kasih konfirmasinya. jika kamu membutuhkan informasi, jangan sungkan untuk chat kami kembali ya atau kamu jg bs mendapatkan informasi melalui help center via aplikasi ataupun website have a nice day. terima kasih by ts
neutral	alhamdulillah..12 set lagi pagi ini dgn nafas ngos..ngossan..sebab kata adinda melawan si umi hrs dgn olah raga, istirahat cukup dan makan enak, ya kan,
neutral	cewek merasa bahagia ketika pasangan meng-anggap dia ada, meng-anggap dia penting, dan meng-anggap dia cewek satu-satunya
neutral	processed food sana murah n senang dpt. fast food restaurant tu bersepah n murah.
neutral	menghimpun potensi menjayakan indonesia selamat menjalankan rakernas i rpi. salam sehat, tetap semangat! yanuardi syukur presiden perkumpulan rumah produktif indonesia,
neutral	kalo support enak keknya combo sama ayaka
neutral	yg enak yg mana
neutral	ini penilaian objektif ya nder, menurutku dari pemikiran yg km ungkapkan di menfess ini bahkan menunjukkan km belum cukup matang dan dewasa nder, yg diliat jgn imajinasi masa depanmu yg bahagia, pikirinnya kira2 nanti resiko cerainya seberapa besar ya? u will think twice
neutral	enak buat tidur
neutral	la lepa kata sup lagi best kat padang brown
neutral	enak dong
neutral	gini kan enak
neutral	bagiku,juara itu posisi dimna ada rasa puas yg mndtngkan kebahagiaan untk aku,mkhlk sekitar,tentu juga tuhan.smpai2 tuhan&makhluk bahagia akan lahirnya aku cnth kecil semut yg bahagia krn aku mmbrinya sbutir gula i
neutral	ga makan duit haram kak, makan nasi lebih enak.
neutral	mimpi qasim 2015- nabi muhammad saw bersabda, ini adalah islam saya dan kerana qasim melakukan segalanya kerana allah & saya berkata demikian, allah akan memberi mereka pahala yg berlipat ganda. ramai muslim di seluruh dunia mendakwa dia adalah imam al-mahdi tetapi dia menolak.
neutral	selamat pagi simeulue , sabtu semarak akhir minggu bersama teman-temanmu apakah kamu merasa masa kecilmu lebih bahagia dari kebanyakan orang? download neo bank masukan kode referral ha4yk2 dapat hadiah tunai rp 18.9rb perjuangan penerapan syariah
neutral	banyaknya petani yang tersebar di seluruh indonesia, menteri bumn gagas program energi tani (et) dengan tujuan membumikan semangat bertani sehingga para petani menghasilkan produk-produk pertanian secara mandiri.
neutral	lebih mending kecanduan si jadi enak ngabisin obatnya, ya gak sih?
neutral	semangat nder, kalau mau cerita silahkan
neutral	juara bukan hanya sekedar usaha dan menang, tapi harus bisa bersyukur, kalau gk ada rasa bersyukur tidak akan ada rasa puasnya dan tidak akan tenang, jadi ingatlah utk bisa bersyukur
neutral	bahagia adalah milik mereka yang bangga menjadi dirinya sendiri
neutral	bunga matahari biar cerah, trims
neutral	bagiku,juara itu posisi dimna ada rasa puas yg mndtngkan kebahagiaan
neutral	maksutt? bukannya malah enak kalo ada pc yaa, bisa ku kolek, kalo station brrti gaada album n pc nya?
neutral	bagiku,juara itu posisi dimna ada rasa puas yg mndtngkan kebahagiaan untk aku,mkhlk sekitar,tentu juga tuhan.smpai2 tuhan&makhluk bahagia akan lahirnya aku cnth kecil semut yg bahagia krn aku mmbrinya sbutir gula h
neutral	ada 5 cara belajarmelihat, mendengar, mengamalkan, tdk cepat merasa puas & terus mengulanginya lagi.
neutral	enak, cantik
neutral	bos! ada f yg mau ditemenin morning enak? dm yuk sini, gue m ada di like, itsyourfriend
neutral	jangan lupa bahagia
neutral	ah kalok dilihat si gak enak
neutral	ngaruhh bngt,dulu pas kelas 8 suka mapel b ing ehh gurune ga enak bngt nyebelin juga jd ga suka b ing sm ga masuk materinya,trs pas guru itu digantiin sm guru lain materinya bisa masuk terus seru juga
neutral	oalahh.. yowes dh, semangat
neutral	semangat loyonya
neutral	orang2 jago banget menghakimi orang lain sekana akan yang mereka liat itu selalu salah ya.. padahal mereka gatau orang yang mereka hakimi itu salah satu orang yang gak seberuntung mereka.. semoga kalian gapernah ngerasain gagal nikah selalu bahagia dn pnya pwsangan yg baik
neutral	lebih enak lg kalo mutualan
neutral	kamu boleh kok, dan kalau butuh temen cerita kamu bisa dm aku yaa. semangat nder
neutral	met pagi semua socialthreeners dimanapun anda berada.. biar semangat, yok donlot kumpulan foto ips3
neutral	engga. tetep tergantung calon pasangan sikapnya gimana. jangan takut. oke? kalau jodoh nanti dimudahkan jalannya. jangan lupa untuk memperbaiki diri sampai menemukan tirik terbaikmu semangat senderr
neutral	bersabarlah wahai hati tatkala ada orang membencimu.sesunguhnya manusia tidak pernah puas mencari kelemahan diri masing-masing :')
neutral	tapi jus oreo g bakalan enak kalo g pake filling
neutral	pagii tweeps.. selamat awali sabtu dengan semangat menggebu. awali aktivitas dengan berdoa.,grafik covid19 kelihatannya meninggi. stay safe, jangan lupa tetap jaga prokes ya..
neutral	nih biar lebih semangat
neutral	ssst iku sing waktu itu nyalon gubernur kalah telak itu bukan ? seriusan nanya. sepertinya negeri ini mjd tkesan tdk baik2 saja sejak bnyak yg kalah pilpres?ilgub?ilbub?pileg. tmasuk sejak byknya mentri & pjabat bumn dipecat, tmasuk pensiunan pjabat yg blm puas
neutral	udah cari grabmart lah, tokopedia fresh, aplah semacamnya tetep sih paling enak mah wassap kang sayur soalnya bisa nitip apaan aja yang gak ada di cart
neutral	beliin mama rukuh biar semangat ibadah njoo
neutral	dengerin kata abang , dulu abang umur 19 tahun bisa dapet piala fa. kalo ade gagal gpp semangat perjalanan masih panjang tapi abang pesen jangan kaya si kayu ijo itu yak!!
neutral	wts rp receh 2±400f,15k ?acc 2, verif all ( dapat email & pass ) 2, masuk ht & mt non moots (boleh test) 2, enak dibuat upfoll 2, go green 2, dapat wa ba verif 2, mastip 17 maret 2022
neutral	dulu setiap lahan kosong bisa disulap jadi lapangan, sekarang kita memilih sewa untuk senang.
neutral	memotivasi mereka untuk belajar dan pintar. orang-orang tua merekapun jg senang dgn adanya pondok pintar papua inu. ucapan terimakasih para orang tua diberikan untuk para satgas yonif.,
neutral	untuk merasa bahagia, bingung, kecewa, sedih, atau marah adalah masalah keputusan. bila anda memutuskan untuk merasa berbahagia maka bahagialah anda. dengannya, kebahagiaan anda adalah sebetulnya hasil dari ketepatan keputusan-keputusan anda
neutral	dulu wkt meniatkan untuk ikut mbkm aja w mikir2 khawatir kalau skripsi w jd gakepegang krn w daftar start-up. semoga kedepannya pada bisa lebih bijak, kadang keputusan yang udah diambil itu gak bisa kita mau 'ah berenti aja', terus orang lain akan jawab dengan senang hati 'ok'.
neutral	enak tuh
neutral	punten mama rossa beneran melupakan al andin baby z. al bukan anaknya mama rossa ya. sampai ketika mama rossa bahagia aja ditinggalin al
neutral	pilihlah warna warna cerah, seperti hijau, biru, atau pink, untuk warna lantai dan tembok kamar mandi anda.
neutral	bahagia bukan berarti segalanya sempurna. bahagia adalah ketika kamu memutuskan tuk melihat segala sesuatu secara sempurna.
neutral	menteri bumn erick thohir menggagas energi tani (et) yang bertujuan membumikan semangat bertani kepada masyarakat,agar bisa menghasilkan produk-produk pertanian secara mandiri.,
neutral	semangat.jangan cengeng.sini cerita sama kita
neutral	safir digulirkan ke arah dimana gerobak penjual crepes berada, yang dijual oleh ahjussi paling berbakat ( menurutnya ) membuat crepes, disana. . . katanya, ini crepes paling enak di seoul! padahal dia cuma tahu tempat ini, itupun karena dekat &
neutral	wah senang disangka 00 line tampak muda aku disana sujiya?
neutral	semangat dong nitip rok sebentar
neutral	orang-orang yang suka berkata jujur mendapatkan tiga hal, kepercayaan, cinta, dan rasa hormat. (khalifah ali bin abi thalib)
neutral	buat bass ada kak raska . kak raska ini dari dulu suka banget sama bass. makanya pas ada rencana bikin band langsung deh dia gercep buat ikut sebagai bassist
neutral	itu makanan kesukaan dia kan? entah makanan kesukaan dia atau dia emg suka sama ayam itu. dia juga bbrp kali mentioned ayam itu di livenya
neutral	di tengah2 generasi yang butuh instant gratification, ternyata kesabaran itu kunci utama yang dibutuhkan untuk bertumbuh. ini ada 1 quote dari leo tolstoy. yang gue suka banget yang menggambarkan tentang proses dan waktu.
neutral	/ju mbl mbl murah banget loochh ayo guys join go miracle, suka dr0p jajan murce rd sering open sh4ring merch juga dan sekarang lagi open tabungan buat cb bangtan baru dr0p jimin unyel nih, yuk gass join link di rep yaa
neutral	setuju banget, lama-lama juga agak gimana gitu liat yang suka bilang begitu.
neutral	capitano rela dipotong gaji untuk bertahan, tapi milannya keterlaluan nawarin angka gaji barunya. emang suka banget manajemen skrng lepas pemain jd free..
neutral	olaa its acaa! ayoo nonton sama acaa kebetulan acaa available hari ini dan seterusnya,, acaa juga suka banget nonton nanti acaa kasih watching list acaa! kalo sender berminat bisa langsung dm dan ini card acaa yaa
neutral	ppp! buat kalian yang butuh epha app prem yg murah, fastrespon dan suka kasi promo, aku opres batch 2 sampe full member nih! mau intip pl atau mau nanya2 dulu? bisa banget! rep aja nanti kuketuk dm-nya ;3
neutral	yahh anjir ada tu 1 lagi yg gw suka banget tp lupa judulnya. apa ya
neutral	mbl mbl murah banget loochh kuy! guys join go miracle, suka dr0p jajan murce rd sering open sh4ring merch juga dan sekarang lagi open tabungan buat cb bangtan tabungan mulai 25k aja guys yuk gass join link di rep yaa
neutral	mbl mbl murah banget loochh ayo guys join go miracle, suka dr0p jajan murce rd sering open sh4ring merch juga dan sekarang lagi open tabungan buat cb bangtan tabungan mulai 25k aja guys yuk gass join link di rep yaa
neutral	bapakku arsitek, dan klo bikin rumah selalu ada bagian terbukanya katanya biar gak panas. alias biar hemat ac. dan bagian terbukanya gede banget. tp aku gk suka. soalnya klo hujan selalu ketampon! alian air hujan yg kena angin msk ke bagian tumah yg tertutup atap.
neutral	aku tau ini pasti terdengar tidak nyaman. tapi ya gimana kalo sop nya memang gitu. tapi aku kalo dipanggil ibu suka kaget dan ekspresinya kelihatan gitu, jadi dipanggilnya mba. gpp, gpp. kamu harus terbiasa.
neutral	dulu gue pernah diajarin buat cari tau apa yang gue "suka" dan "bisa". ini exercise yang cukup unik, karena ini logical banget. ketika kita mau nge "flow", ya kita musti start untuk bergerak aja dari hal2 yang keliatan. nanti kepercayaan diri akan terbangun sendirinya.
neutral	zoo apa bener sgm yg bebas laktosa ini bisa buat kitten? aku ada kitten umur 7 hari yg ditinggal induknya. aku udah coba kasih growsy gak suka
neutral	ketika kita suka sama suatu hal, pasti itu akan jadi kekuatan kita. karena ya ketika kita ngerjain itu, everything is flowing and we feel happy. tapi kan, kita lagi kena impostor syndrome,lagi gak pd banget sama diri kita. gimana cara cari tau apa yang jadi kekuatan kita?
neutral	kayanya dlu gua suka honeystar deh, udh lama banget ga makan cereal
neutral	kasih gue satu alasan kenapa pada g suka matcha? hmm?
neutral	ya walaupun kadang gue kalo kesel suka kelewat batas. tp skrg gue lg berusaha banget biar ga negatif" amat jadi orang minimal sopan lah
neutral	kamu kenapa suka banget buka kartu haha.
neutral	jaman dulu w naksir seseorang masih kasih usaha buat deketin walaupun gak pengen confess apalagi jadi pacar. dulu seneng bgt bisa intens sms an dg dia. sekarang mah boro-boro. adulting makes me focus on myself. kalopun suka seseorang, yaudah suka aja. gitu tok.
neutral	saya lebih suka otoriternya alm pak harto. harga dikontrol mafia pangan gak berkutik. migas dikontrol gak ada yg berani nimbun. preman disikat masyarakat aman tentram. sayang org2 disekelilingnya kurang baik. ada gbhn dan repelita arah pembangunan yg jelas.
neutral	jangan masuk psikologi kalau gak suka hitung-hitungan atau gak suka berusaha. di psikologi ga harus pinter yang penting tekun dan konsisten karena banyak banget matkul yang sifat penugasannya jangka panjang dan butuh kesabaran dan konsistensi dari diri sendiri
neutral	terus suatu ketika ada temen aku bilang dia jadi suka sama youngk dan dia kasih tau aku day6, saat itu aku udah tau day6 sih tp membernya nggak tau siapa aja kecuali si jae sama youngk didengerin lah aku lagu day6 you were beautiful dan diracuni suara youngk eh tapi aku malah
neutral	ok dah tu, sorg marah ss akhirnya jd org kuat ss, sorg marah dsai at the end mntk kerusi..tu la cinta itu buta, mula2 gaduh, lps tu suka..
neutral	sender suka banget member di era-era di bawah ini. sehenernya ini pilihan yang sulit, mengingat semua member pada cakep2 di era apapun itu, hehe. kalau versi kalian gimana nih?
neutral	yang ni tak payah cakap banyak. tengok muka pun tahu jenis suka buat onar. terima kasih kerana report kami akan masukkan dalam list untuk report klik:
