label	tweet
fear	dia mau marah pun lucu banget tapi jika masuk teel orang lain aq maloe
fear	tapi keinget pas lsp ngejurnal manual sampe arus kas gue lancar, komputer juga lancar, eh giliran ujian teori gue zonk bgt tiba2 kek orng bego wkwkw
fear	mo marah ngeliat orang pake filter mata banyak2 di muka yaallah merinding gue
fear	kalo ditembak nanti pacarku marah:3
fear	nervous bodoh
fear	mampus pelatih dance gue pasti marah bnyk yg izin
fear	ngga si kak, tp baru sampe rumah jam 8 pagi kyinya fix ngantuk bgt gak kuat melek td kirain 10 malem gt wkwk mino km benci aku ya
fear	koyok e dendam deh nih kocheng, grgr mau subuh tak kancing i lawang
fear	njir gue sakit tenggorokan, gk enak badan, tulang linu jd mikir kena cvd, ngeri
fear	bulan engga enak ati ga si ini
fear	aku ga pake yang niacinn tp yang botol ungu gila bgt, kaget bisa langsung cerah sekali pake, agak ngeri
fear	berlaku buat seller juga sih. kalo sudah ada yang take, at least ngabarin ke calon buyernya biar sama-sama enak. kalo sama-sama ghosting ya gimana wkwk ngeri juga
fear	km luarnya klo ada mbak?as kebersihannya enak jd ada yg bersihin tiap minggunya. yaa krn bareng2 jd kurang privasi aja km dalemnya privasi terjaga, kl mlm ga usah keluar kmr. kl kamarnya kecil jd lembab, rawan binatang2 kecil, bau huhu (klo g rajin bersihin ya)
fear	cerah aja apa buat hari ini, aku mau ke jtp. ga lucu kalo ujan, terus gagal lagi.
fear	kalo sosis rebus enak, tp nugget?? aneh gk sih???
fear	feelingku ga enak emang sama ini wkwk
fear	mjb, itu janji jiwa nya biar udah dua hari masih enak rasanya? gk basi?
fear	ada yang bisa hack ig ga? tolongin banget , hati gua udah ga enak dari seminggu yang lalu
fear	gue klo di mall suka ga enak sama yg baru nge pel. dan ga ada jalan lain. akhirnya jalan jungkit2 sama bilang maaf ya mas ?mbak
fear	kenapa ya perasaan ku gak enak, mau pergi padahal nanti
fear	ga enak banget tinggal di tempat orang
fear	duren kalo langsung ngga enak, kalo olahan baru enak, takut cium baunya
fear	sebenarnya bagus, cuma karna sellernya galak jadi pada ngeri
fear	gatau. tapi aneh banget kok orang-orang banyak yang suka sama dia?
fear	takut banget, serius. enih mereka tempat gw curhat, tp gw suka lupa mau curhat
fear	aku di sini cengeng, suka misuh, tiap hari ngeluh, belom lagi kalo ngomong kasar, jadi tau aku aslinya kek mana. takut aja kalo ada temen rl nanti yang ada makin gak nyaman sama aku. jadi kalopun ada temen rl yang aku ajak ke sini, i know i trust them.
fear	in other hand belum berani nonton kukira kau rumah meskipun suka banget lagu dan musikalnya krn (selain omicron) jg takut mental health jadi bagian dari plot aja
fear	aku gak pernah minta nebeng kecuali emang ditawarin, karena ya ini dan gak enakan juga soalnya waktu itu ada temen yang cerita dia sebel banget minta ditebengin mulu mentang" searah. jadi suka kepikiran kalau nebeng dia keberatan apa enggak
fear	yang biasanya pendiem banget, kalo tiba-tiba oversharing itu kadang suka ngga kekontrol, terus akhirnya nyesel udah cerita jadinya takutan
fear	masih kepikiran ji ung kenapa rela suka sama yeon su lama banget yak padahal dah dari jaman kapan tau emang yeon su cuma buat choi ung sepaket, pemeran utama. ga akan yg tiba2 moveon ngga si org kayak yeon su. eman waktunya mas
fear	serem banget mio-chan ternyata suka makan dinosaurus.. -s
fear	sumpah bukannya gue ga nyaman cuman gue takut malah suka sama lo kenapa lo ga peka sih kak gue jadi lebih diem tuh biar gue ga jatuh lebih jauh
fear	nah iyaa, kaget banget terus mikir "kok bisa dia suka sama gue"
fear	bukan nggak suka sama seriesnya, iya aktingnya bagus, soundtracknya jg bagus, tapi ceritnya serem. serem banget.
fear	”karena ditempat kaos kaki suka banget amburadul ga di gulung habis dicuci, jadi pagi pagi buru buru kadang ga mikir. pas sampe kelas baru sadar :d tapi trobos aja sih ampe panikan
fear	dulu aku gini, sampek sd kayanya. ga suka sama rumput2, apalgi yg tajem2. takut, nggak nyaman, geli hassembuh lah pokonya wkwk
fear	jap i confuse crush i kan up status takde sapa sayang dia padahal dia tahu i suka dia and kalau nak cakap lupa i tengok status dia hari2
fear	ga berani ngucapin happy birthday ke cowo yg gue suka anj. kalo gue pikir pikir sekarang, kek dulu gue bego banget anj. padahal itu kesempatan emass
fear	kdg suka ngayal nemenin doi wisuda beh bahagia banget kali yak rasanya wkwk. tp takut juga kalau pd akhirnya bukan aku yg nemenin
fear	zoo anabul kecil tetangga aku gamau diem, kadang suka tbtb masuk kerumah. kadang suka pup diteras rumah jg, apa karna sering kita kasih makan jadi begitu ya?
fear	aquarius gak pinter bohong, to the point banget dan kadang karena to the pointnya dia itu suka bikin sakit hati jadi takut ketemuan
fear	ayah suh bawa exora g hostel memang kelat la muka guwe bukan enggak suka tapi takut drivenya malah mobil nya gedek banget
fear	pengen banget beliin layout kapel buat pcr virtual tapi masalahnya kita brdua suka layout mati lampu
fear	kalau yang nggak terlalu pait, masih sukaa. tapi kalau yang pait banget nggak suka wkwk takut ama rasa pait soalnya
fear	degdegan banget hari ini ya ampun.. semoga lancar,,sinyal bisa kerjasama ya please.. tabletku jgn suka tiba2 no connection ya! salam sehat waras semuanya
fear	minderan anjir klo suka sm org. abis gmn ya gua selalu aja suka sm santri, dgn fisik yg tdk memadai serta akhlakless gini jd lebih nyaman mencintai dlm diam wkwk. udh gt doi pernah liat gua nyedot tijus make selang, apa ga nambah jijay??
fear	sering, dan sampe hari ini pun masih suka kaya gitu. gak tau suka takut aja gitu, apalagi klo malem beuh kadang deg degan banget. mana blm bahagiain ortu makin makin dah ketakutan
fear	langsung aku unfoll loh, ternyata alasan orang2 pada ga suka sama dia sekarang jelas banget orgnya bikin ngerian
fear	takut banget km suka orang lain huhu :(
fear	aaakk sama banget kaya temen sma aku, dia teriak2 di sekolah minta cutter buat bundir astagah. legend banget si. dan masalahnya ya dia putus sama cowonya trs cowonya suka sama cewe lain, ngeri bangettt
fear	baru nyadar dulu kenapa suka banget beli boneka babi. jadi numpuk di lemari gini astaga
fear	haha, bener : dit, jgn pasang muka judes gitu dong. ntar kalo diliat sama mas anu kan nggak enak. dia kan suka sama kamu. kaget banget cuy. dia lho, temennya pada cakep2 semua. kok bisa sih sampe naksir sama remahan roma kelapa kek aing gini? kan rada nggak make sense.
fear	haii, aku mau nanya. sekalipun diminta cv doang juga tetep kasih surat lamaran kerja? bedanya body email sama surat lamaran kerja apa ya? soalnya aku masih suka susah bedain.. dan aku selama ini ngirim file cv, di body email kayak lamaran kerjanya(?) takut salah
fear	iya, sering. terus, suka mikir, "ada berapa bayi yang lahir hari ini, ya?" random banget njir gue :"")
fear	ada ga sih cewe yang tulus ke aku, takut patah hati
fear	memfilter org org yg toxic yg suka ngurusin hidup orang. parah banget ngerinya
fear	udah mau tanggal 14 februari. tolong jangan aneh-aneh yah pas valentine day, soalnya gua gak suka sama scorpio. tolong banget nih.
fear	gataunyaa, emang suka dikerasin gitu, bahkan suka dibuat rada lebam gitu. anw akting mereka keren banget sih di sini . ini engga bohong gue jadi kek dibawa ngerasain rasanya jadi dom dan sub gitu, jadi penasaran plus ngeri geli gitu
fear	gw sering banget typo ya allah. mana kalo typo suka ga sadar lagi keknya typo adalah jalan ninjaku.
fear	mbakk.. aku kalo jadi kamu bakalan malu banget sihh coba bikin statement permintaan maaf dulu trus abis itu rest hehe tp semoga ga blunder lagi ya soalnya aku liat tweet kamu akhir2 ini suka blunder
fear	mau tanya, kalian lebih suka /bw kalo di au tuh yg seumuran/ si bright lebih tua jd manggil kakak gitu. bimbang banget
fear	takut banget kalo sampe nikah keluarga ga suka. trus cuma datang langsung pergi kaya tamu. kalo gitu kan kesan gak sukanya emang keliatan gt ya.
fear	kenapa ya gue suka kaget ada luka cakar? kucing sendiri. cuma kadang gue gak inget terus pas lagi elus kaki ada luka melintang, ternyata cakar kucing. dan pagi ini ada lagi. dua pula. mana gede banget anjir. fix, ini kucing yg paling gede.
fear	suka, kadang berasa lagi ngomong sama dahyun soalnya ak mirip banget sama dahyun tapi ragu-ragu
fear	jangan jatuh cinta dan suka daripada sakit hati!
fear	aku gini, mamah nya masih sering banget minta temenin pegi atau ga nyuruh main kerumah. padahal mamahnya tau kita udah ga bareng. berasa takut , takut bikin risih pasangan doi nantinya. dan akhirnya aku suka cari alesan gitu, dan aga ngasih space
fear	aku mah masa tiap harii sama kadang nih paginya ga ngapa2in tetep aja ke logout , makanya ini suka degdegan banget takuut
fear	ga boleh boncengan cowo cewe kalo bukan sodaraan, aneh banget sih menurutku. soalnya kan banyak nih cowo-cowo yang suka dengan baik hati nawarin boncengan soalnya ya emang baik aja gitu as a friend, masa gabisa sih. btw ini sekolah negeri ya
fear	ini kcg rumahan ga kemana-mana sama mamanya terus tapi itu lehernya kaya luka. apa karena suka gelut diajarin mamanya itu ya tapi masa sih? kcg! btw itu aku pegang posisi dia nyaman dan bentar kok
fear	jangan pernah lo sia2in, lo kecewain, lo sakitin orang yg sayang dan udah nyaman sama lo demi orang yg lo suka. jangan!
fear	kalau dia lgi marah omongannya pedas banget suka banting barang apa pun yg ada didekatnya
fear	ga. gue tuh pengen tidur cepet, tapi selalu nggak bisa, selalu ga tenang. kayak ga ngebolehin gue buat tidur. kadang suka kebangun lah sampe bangun-bangun pusing. ini juga gegara begadang mata jadi keliatan capek banget sama kantong mata item banget
fear	terus tadi gue sempet stalk ig nya gitu terus lo tau?? gue ga sengaja click like anjir demi allah gue langsung ah mau menghilang dari bumi!! terus kalau di sekolah kan suka papasan gitu gue suka pengen nyapa tapi takut, duh gimana ya cara kenalan nya? kasih tips dong
fear	ngga tau kenapa dr kecil aku takut banget sm laut. lebih suka bukit , gunung sebenernya suka banget tp kan dingin, aku gak kuat dingin. takut pingsan kl kedinginan.
fear	kenapa ya orang suka banget ujar kebencian, ga mikirin perasaan orang lain tuh sedih atau kepikiran gituu, aku jadi takut makin banyak orang jahat
fear	iya njir, deobo gada kabar samsek, agak kawtir
fear	harap demam biasa :( takut copid
fear	skrg gwe gk berani lg nntn sndiri di bioskop, pdhl dlu biasa biasa ajj, knp yh
fear	semoga baik baik saja
fear	sabtu pagi bukannya dapat kabar gembira malah dapat kabar yang bikin deg degan alias t____t jadwal ujian sekolah sama ukk bulan depan
fear	di tlp ex bisa biasa aja tapi kalo ketemu jantung saya tidak aman
fear	ga biasa bgt. weekend padahal. suami bangun pagi, jogging, nawarin aku mau makan apa dan langsung dibeliin, lanjut sarapan bareng. kesambet apa dia
fear	mulut berkata "jalani saja dulu" sementara hati ngedumel deg"an "bisa skip ngga sih"
fear	kirain saya saja yg g sk seblak, nyium aroma y saja mual
fear	mu tersingkir di fa cup? jangan bercanda deh kalo ngasih kabar tuh ah
fear	karunya teuing ihh semaleman khawatirr gada kabar
fear	tatapan matanya bisa biasa aja gakk ngeri liatnya
fear	bangun bangun dapet kabar temenku positif takut jadinya
fear	dua hari ini, ngerasa flu tapi gejala omicron gtu. semoga aja si emng flu biasa, bismillah gpp meski takut
fear	ta tapi aku biasa ga di aduk takut gk enak
fear	tdr gua knp gabisa tenang si, ya gua tau setiap hri hrs bgun pgi, tp setidaknya ksih wktu buat ngumpulin nyawa dl kek, pala gua suka tbtb pusing hrs lgsung gerak bantuin ini dan itu, ya tp gpp si udh biasa jg. mana klo lg tdr kdg suka diajak ngobrol.
fear	* sepasang muda-mudi lagi nonton bioskop. ceweknya berbisik, mas ada orang onani di sebelahku. "cuekin saja," kata cowoknya. "ngak enak mas, dia paksa pakai tanganku! takut"
fear	hlt! guys, aku punya kebiasaan ngopi, ga tiap hari sih, cuma kadang.. nah pagi ini abis ngopi, tb2 bagian atas selangkangan sebelah kanan sakit..kira2 ada hubungannya ga ya? tapi aku buang air ga kenapa2,normal..
fear	orang di rumah sakit sudah biasa ketemu dokter, lah aku malah takutan
fear	sekolah itu biasanya ramai tapi ramai karna makhluk tak kasat mata wkwkwk bikin merinding
fear	4 bln ya desember lalu gw kaget mulu klo om gw dateng. takut ngasih kabar kematian.
fear	wowkowkwowkwowow bjimsroott 2 aja ngery ap kabar gw 9 takut nih wkkwk
fear	sore - sore harusnya bisa tenang ini malah deg"an gegara dikagetin gk jelas
fear	iya iyaang.. mau reply biasa gw kong tapi gw tag bapak ade,takut nganu nanti
fear	plis wei baru bangun tidur tiba2 pas buka twitter dapet kabar denise
fear	lah lah kaget dong aku, kok kamu malah sedih??
fear	aneh bgt perasaanya ga enak gini. kek degdegkan, sedih, takut gt. bismillah smoga lancarr aamiin
fear	kadang tu kalo malem terus kamar sunyi tiba² ada suara cicak tu ngeri anjir gue langsung bangun lagi
fear	asli gue pikir temen gue sedih ga bisa jadi kutu beras aja udah aneh apalagi gue makin ngeri dah
fear	bisa kesurupan klo main ditempat sepi
fear	break dulu, soalnya gamau kecewa untuk yg kedua kalinya sebelum ketemu yg benar-benar tulus
fear	takut aku kecewa
fear	kepikiran bikin ginian dari kapan tahun karena merasakan susahnya cari peralatan bayi tp dipakai cuman sebentar. tp liat kondisi daerah sini gak memungkinkan, banyak yg sepi jasa sewanya, agak meragukan
fear	mending gausah deh daripada kecewa
fear	ini yang gue takut, kalo uda mulai berharap sama orang, tkut kecewa.. :)
fear	gak enak , jangan sedih sedih juga ah , jadi ngeri nih
fear	sakit banyak quin ini masih mau diperiksa penyebabnya. temenin dong takut nih sepi sekali
fear	sedikit sedih kmren ngga jadi tindakan injeksi tp emng bener kata dokternya, aku dah vakum 3 bulanan, jd kalo langsung injeksi lg nanti kaget malah kmren cuma dikasi obat sama salep gt banyak bener, jadi takut sendiri
fear	gara2 osd ceramah masalah ks, diotak gua terngiang2, kebayang2 ketakutan yg slama ini gua simpen sendiri. gimana klo nanti gua digituin? gua balik ke ortu? sedangkan bpk gua pelaku, emak gua korban yg bikin sedih trauma2 masa kecil masih membekas jd bikin
fear	naik mobil yang disopirin bapakku, ekstrim bgt, mentang2 jalan papua sepi, kecepatannya selalu di atas 100. rasanya kek diajak mati
fear	karena rasanya aib banget gue takut stigma orang2 mandang gue orgil:") setakut itu padahal sekarang udah banyak banget yg speak up tentang mental illnessnya masing2. makanya gue agak gedeg sama orang2 yg ngaku2 punya mental illness bermodal self diagnose. sedih bgt gue liatnya
fear	menjijikan sekali:( kesel, marah, sedih, takut!! ngerrriii arghhh
fear	ff, ya? hmm, romance, sih. soalnya itu genre paling aman. sebenarnya in general sukanya family tragedy, tapi kalau lagi butuh dua itu, aku larinya ke film; jarang lari ke ff because i tend to expect dan takut kecewa”nanti jadi gak comfortable lagi.
fear	mana pulangnya kan malem ya, eh jalannya tbtb sepi gada lampu jalan :" agak gimana gitu
fear	takut kecewa sama ekspektasi
fear	inget guys teras cihampelas bandung tempat relokasi penjual sepanjang jalan cihampelas aja ga efektif. mungkin beberapa bulan pertama bakal banyak pengunjung tapi setelah ketemu banyak minusnya bakal sepi dan kumuh, jadi agak jijik gitu
fear	takutnya kecewa,jadi kasihan gitu
fear	ni nhapa sepi amat dah ngerii
fear	bgt! sepi dan serem
fear	sepi aneh kayak ada yg perhatiin tapi gk ada sapa"
fear	joonyoung.. paling merinding sama sedih jadi 1
fear	mau nonton kukira kau rumah awokaowkwk, tapi takut terlalu sedih jadi kalut
fear	gila, sepi bgt rumah gue berasa nge kos nying takut ah
joy	dipeluk enak nih
joy	masih dongg wkkwkwtar klo gk semangat gk bisa bucinin bebep2 aku
joy	semangat dan bertambah kuatlah kalian frp_natsud_ frp_lucyheart frp_wendy ~
joy	jangan lupa sarapann semangat buat hari inii ayang semoga harimu menyenangkan !!
joy	aw ikut seneng semangat ya kuliahnya!
joy	semangat!!
joy	senang bermain salju
joy	nikmati, bisa senang-senang bareng teman tapi tetap produktif,
joy	akhirnya syuting lagii, semangat ayank
joy	kalau yg cuma kembang tahu doang, aku belum pernah coba tapi pasti enak.,duh lupa namanya
joy	ingett wkwk. iyaa dog lalu kita bertiga , sama dina mabuk kepayang sama legollas, pinjam cd nya di rentalan , astagaa kita remaja bahagia ya waktu ity
joy	semangat kak. sudah terima chat wa dari kemenkes belum. disana ada petunjuk konsul gratis online dan tebus obat.
joy	semangat ngantornyaa
joy	pokok semangat sek
joy	happy birthday jiann adek gantengkuu gemes ucul kuat perkasa semoga rl charamu dan kamunya sukses terus, bahagia selalu, dikasih banyak rejeki & kedamaian hidup, banyak yg makin sayang sama kmu juga! have a wonderful day
joy	hai kak hwii!! don't skip ur breakfast yaa,semoga harinya berjalan lancar,dimudahkan segala urusannya,dijauhkan dari marabahaya,semoga selalu ada dlm lindungan tuhan,janlup vitaminnya ya,semangat!! janlup senyum hihi,stay healthy & always be happy!! have a great day kak
joy	semangat buat hari ini!
joy	sering-sering bikin au taeyong yaakk, seruu! semangat teruss nob
joy	semangat kamuu
joy	ojo lali , ngemil ceria by
joy	semangat buat hari ini, have a great day
joy	terlalu dini menjadi tulang punggung keluarga,ya sama.semangat kamu lantas berbahagia apapun kondisinya
joy	agak enak ya kakk jadi nya
joy	semangat
joy	kombo diluc-raiden enak kok.. gk terlalu mental2 masih bisa dijangkau
joy	peluk kakak semangat terus ya pokoknya, banyak yang sayang sama kakak di sini,yoon ji lagi cosplay jadi warga lokal
joy	wkskwkw aku juga pernahh jadinya sampe gabisa buat buka galeri ya allah cape banget ya hp penuh tuh, wkskwk semangat anya bersih bersihnya wkwkw hapus apk yang udah ga dipake aja
joy	benar guys, nasi goreng.,simple, cepat, dan enak.,saatnya lanjut beres2 dah, ini rumah udh kaya' gak ada penghuninya, debu udh mulai bermunculan lagi.
joy	kasih semangat dong moots
joy	selamat pagi., salam sehat n bahagia untuk semua
joy	nggak tau ya aku up lagi kapan, lagi nggak enak badan dari akhir januari di tambah bulan ini banyak ujian praktek
joy	ga enak, apalagi kalo orang lain yang pake kamar mandi itu jorok. kemarin pas ngekos suka nemu piring kotor, padahal di sana ada tempat cuci piring.
joy	hola kak wawa!! don't skip ur breakfast yaa,semoga harinya berjalan lancar,dimudahkan segala urusannya,dijauhkan dari marabahaya,semoga selalu ada dlm lindungan tuhan,janlup vitaminnya ya,semangat!! janlup senyum hihi,stay healthy & always be happy!! have a great day kak
joy	terima kasih sudah berjuang sejauh ini. bertahan sekuat kuatnya. jangan pernah mengeluh. terus berjuang, terus semangat. walau sendiri, jgn bersedih. masih ada tuhan yg mau menemani tiap saat. for me
joy	pokoknya traveler hidup bahagia bersama paimon
joy	semangaatt kak! buat ga dengerin kata orang susah banget emang, tapi saya berdoa semoga kakak punya support syatem yg baik. tetap semangat ya kak, semoga lekas sembuh, gbu
joy	braithwaitw "kami akan bertemu penggemar kami lagi dan menunjukkan kepada mereka bahwa kami adalah satu tim yang bersatu. kami akan menunjukkan semangat.
joy	okay, kak icus juga semangat ya
joy	ya allah berkati, bahagia hmi..
joy	mjb, yanfei bisa, enak banget malah
joy	semangat pagi, jangan lupa sarapan^^
joy	semangat mbak
joy	ni nder ayo semangat
joy	kamuu juga sehat dan bahagia selalu yaa ;3 thank you soo much udah baca
joy	semangat, vii
joy	enak ga?? Kalau ga ya ga mau
joy	semoga lulus ke universitas impian ya, buat temanny semangat!
joy	kemarin karna gabut produktif di dapur dan jadilah inii, dimasukin ke kulkas dimakan pagi ini msh ttp enak
joy	punya kucing putih dengan paw pink hanya impian di rumah ini. tapi gak papa selama dia bahagia. toh milky ga naik ke kasur atau nginjek2 sajadah
joy	hormat kepada angin semangat everybody. nanti kita akan selesai pada waktunya.
joy	kenapa loyo tuh? semangat juga ya, iyen. jaga kesehatannya jangan lupa.
joy	good moawwnnning! let's start this sunny morning with happiness bb don't forget to breakfast && mandi tp masih kepagian jadi nanti siangan aja :d have a nice day bffs semangat buat hari ini yuuuuup jangan lupa selalu bersyukur many people love you
joy	duuh ga lama lg insya allah ngalami masa2 ini, melepas anak lanang kuliah..pasti ambyar hati mamak ya mbak,selamat belajar mbak n, sehat, bahagia n sukses sll, smoga tercapai apa yg disemogakan, aamiin
joy	semangat di pagi hari
joy	puas banget aaaa
joy	semangat buat hari ini!
joy	semangat yaa. banyak penyesalan yg udh terjadi harusnya pada saat ini gaperlu disesali. yuk bisa yuk buat nata lagi hal hal yg lbh baik
joy	enak banget ternyata kalo tiap hari bisa tidur di jam 8 atau 9 malem , selain bikin gendutan kulit juga jadi bersih sama cerah
joy	wow sangat berbeda hahah, semoga hari sabtunya ikutan cerah juga
joy	demi yaa gtu aja udh enak bangeets
joy	ayang kenapa?? yuk semangat yuk
joy	kabar bahagia banget pagi ini
joy	kalo abis pup pas pagi pagi tuh enak banget ga sih, perutnya jadi rata & langsing
joy	semangat om
joy	kaka juga iya wangi enak aja
joy	iyaa mau makan yang enak yang banyak
joy	serius, aku saksi dua orang yang semangat buat terus lanjutkan hidupnya karena kamu. dan itu dua orang yang sangat kusayang dalam hidupku. aku tidak bisa berucap hal lain, selain kata terima kasih.
joy	semangat jalani hidup dengan bahagia yang seperlunya, bersedih dengan seperlunya, dan bersyukur sebanyak-banyaknya
joy	have a nice day, semangat buat hari ini
joy	semangat bestie
joy	semangat pagi
joy	tepuk semangat se ma ngat se~ ma~ ngat~ *yeayy*
joy	semangat zi
joy	sudah sampai disini, bahagia pun menanti
joy	semangat sayang
joy	dangdut enak
joy	bismillah,,tetap semangat jangan menyerah,,yakin pasti bigwin
joy	orangtua kita selalu bahagia melihat kita, selalu tercurah kasih sayangnya buat kita tanpa batas..
joy	semangat okeyy
joy	sebab tetap, pencen n senang dpt loan kot huhu
joy	selamat hari sabtu juga ibukk, semangat buat hari ini
joy	semangat terus pejuang receh di pasar
joy	enak tapi
joy	selamat pagii princess!,semangat berkegiatan, tetep jaga kesehatan ya !
joy	saat paling bahagia menurutnya adalah saat ia tidur.
joy	semangat ych hari ini
joy	semangat eventnya, cantik.
joy	cerah banget
joy	siipp kak, kalo gitu bisa ikutin semua s&k giveaway yg ada di caption postingannya ya. semangat terus! :) ^mc
joy	sabtu sek semangat makaryo pren, uang kenakalan cair.
joy	semangat juga beb
joy	pagi yang ceria
joy	semangat aku
joy	pagii~ btw cuaca enak gini mendingan tidur yok, have a nice weekend~~
joy	morning win win metawin semoga makin banyak solo projek, solo endorsement, series baru dan projek-projek lain yang bikin win bahagia.,
joy	cuma mau infoin, enak banget
joy	optimis bisa, semangat pak! menteri bumn erick thohir ingin harumnya aroma kopi indonesia bisa tercium hingga mancanegara,
joy	tapi ini enak bgt
joy	semoga bisa tercapai ya kak, semangat untuk temennya!
joy	puji tuhan ku bahagia banget rasanya dapet kabar jimin udah sembuh..
joy	tapi itu langitnya cerah
joy	bubur kuah kuning ternyata enak banget ya
joy	day 1 terlalu semangat terus datengnya kepagian dan belom ada orang
joy	semoga keterima ya semangat!
joy	pagi pagi dapat kabar bahagia
joy	aamiin, semangat
joy	kurang 400k sampe target yoo semangat markf
joy	ujan teruss enak
joy	happy birthday moa dan taehyun!! semoga panjang umur, sehat selalu, bahagia selalu!!
joy	suka banget sama lagu bangtan yg film out itu enak banget di telinga gue ada yg sama ga? jangan lupa streaming di semua platform musik ya termasuk yt,i vote for for at the 2022,
joy	dimana mana hatiku senang
joy	semangat setelah sekian lama nggak pernah event aku kak.. t__t
joy	semangat.
joy	semangat menjemput rejeki coy
joy	selamat pagi mbak,salam sehat penuh semangat dan selamat beraktivitas selamat berakhir pekan
joy	pagii semangat ya kamu hari ini, have a good day
joy	pagi" ujaann enak bgt buat tidur
joy	wkwkww kadang mo ngelarang nyanyi dia nya dah kepede en dlasal bunyi aja , asbun.. dan bahagia buat dia
joy	yukk semangat yukk walaupun badan lagi kurang fit
joy	nyenyak! semangat juga!!
joy	kalo baring bawaannya lelah, kalo kerja bawannya semangat terus, salut sii sama diri ini
joy	hiih km harus ikhlas, semangat berproses semuanya
joy	nggak dong~ aku beli loyang 14cm 1 biji juga kemarin wkwkwkwkwk sempet mau beli yang 14 itu 2 sekalian kan enak kl mau kasih incip tetangga. tp nggak jadi beli 2 jadi besok gak bisa langsung ngovennya
joy	semangat ktnya
joy	udah semangat lagi kan, chaeyi?
joy	wihh semangat pkl nya onad! dah sarapan lums? kalo lums sarapan dulu yaa, have a nice day ;3 stay healthy
joy	happy birthday mbar.. sehat dan bahagia terus yah!!
joy	kemarin di gramed ada bocil lg disuapin mamaknya makan promina keknya enak bat duh
joy	ngopi enak
joy	wkwkwkkwkwk semangat nguli, cla
joy	disini rian, enak bgt klo buat lanjut tidur
joy	sarapan tenongan si enak
joy	streaming child pagi pagi enak banget selingannya ssfw sama we go up
joy	congratulations for ur debut "child" makna nya dalem banget huhu. kek relate dalam kehidupanku juga kehidupan oranglain mungkin, semangat terus buat karya karyanya yang lain nanti. bahagia selalu buat kalian. me lafyu. xx t.,
joy	kokk enak tau mcam kiko
joy	semangat nidaa
joy	semangat semangatt
joy	semangat lesnya!
joy	enak bisa lanjut tidur
joy	nah kalo gini terus terang sama2 enak ya mas, asal minta bonus'nya ngak gede2
joy	pngen bgt baca sejarah tentang avicenna lgii heuheu ayo semangat bacanya kii :)
joy	rebahan emang paling enak ga sih
joy	wih kereen. mauu. keliatannya enak semangkanya disendokin gitu. berasa kayak di drama cina
joy	semangat yaa para pejuang keluarga.. semoga dilancarkan rezekinya yg berkah.aamiin
joy	terima kasih pak ri 1 presidenku tetap semangat ya pak membangun bangsa ri
joy	semangat puasanya an
joy	makasih nokaav bahagia selalu juga
joy	semangat buat hari ini ya!! u deserve to be happy. anw, jgn lupa sarapan
joy	semangat kakak
joy	gm ayu! berkobar2 semangat
joy	semangat ya.. jangan mau dijadiin mainan
joy	bismillah semangat hari ini, semoga banyak req dm amin
joy	semangat semangat haha hihi
joy	enak banget jadi orang serba bisa.
joy	semangat, hati-hati dijalan meii!!
joy	nda semangat on rp
